{
  "config_revision": 12,
  "serial": {
    "port": "/dev/serial0",
    "baud": 1000000,
    "write_timeout": 0.5
  },
  "synth_ids": {
    "drums": 0,
    "bass": 1,
    "strum": 2,
    "manual_chord": 3,
    "rhythm_chord": 4
  },
  "voices": {
    "drums": 4,
    "bass": 1,
    "strum": 2,
    "manual_chord": 7,
    "rhythm_chord": 7
  },
  "midi_player": {
    "synth_ids": [5, 6, 7, 8, 9, 10],
    "drum_synth_id": 11,
    "voices_per_synth": 4,
    "drum_voices": 8
  },
  "midi_input": {
    "enabled": true,
    "tech_profile": "auto",
    "device_glob": "/dev/snd/midiC*D*",
    "alsa_raw_globs": ["/dev/snd/midiC*D*"],
    "oss_midi_globs": ["/dev/midi", "/dev/midi[0-9]*", "/dev/amidi[0-9]*"]
  },
  "osc_input": {
    "enabled": true,
    "listen_address": "0.0.0.0",
    "listen_port": 8000,
    "advertise": true,
    "service_name": "LB Omnichord"
  },
  "default_synths": {
    "chord": "juno_004",
    "strum": "juno_028",
    "bass": "dx7_143"
  },
  "synth_programs": {
    "physical_strings": {
      "type": "karplus_strong",
      "label": "Physical Strings",
      "oscs_per_voice": 1,
      "wave": 6,
      "feedback": 0.985,
      "high_note_gain": 10.0,
      "high_note_start": 60,
      "high_note_full": 96
    }
  },
  "instrument_levels": {
    "juno_074": 0.2,
    "juno_089": 0.4
  },
  "role_levels": {
    "drums": 1.0,
    "bass": 1.0,
    "strum": 1.0,
    "chord": 1.0
  },
  "drums": {
    "kit": "gamma9001",
    "velocity_gain": 5.0,
    "sample_map": {
      "bd_haus": {"preset": 0, "note": 60},
      "drum_bass_hard": {"preset": 2, "note": 60},
      "drum_bass_soft": {"preset": 0, "note": 60},
      "drum_snare_hard": {"preset": 12, "note": 45},
      "drum_snare_soft": {"preset": 14, "note": 41},
      "drum_cymbal_closed": {"preset": 9, "note": 60},
      "drum_cymbal_pedal": {"preset": 9, "note": 57},
      "drum_cymbal_open": {"preset": 10, "note": 60},
      "drum_tom_hi_soft": {"preset": 17, "note": 70},
      "drum_tom_mid_soft": {"preset": 17, "note": 67},
      "drum_tom_lo_soft": {"preset": 16, "note": 61},
      "elec_tick": {"preset": 15, "note": 90},
      "perc_bell": {"preset": 18, "note": 66},
      "perc_snap": {"preset": 3, "note": 60}
    }
  },
  "rhythm": {
    "chord_gate_beats": 0.72,
    "bass_gate_beats": 0.3,
    "max_rhythm_chord_notes": 4,
    "sequencer_reset_guard_ms": 10.0,
    "tag_ranges": {
      "drums": {"start": 0, "count": 56},
      "bass": {"start": 56, "count": 56},
      "chords": {"start": 112, "count": 140}
    },
    "sequence_ranges": {
      "fills": {"start": 256, "count": 936},
      "chords": {"start": 1192, "count": 64},
      "drum_bases": {"start": 1256, "count": 24}
    }
  },
  "performance": {
    "strum_gate_ms": 800,
    "one_shot_chord_gate_ms": 650,
    "strum_tail_ms": 450,
    "synth_alloc_guard_ms": 10.0
  },
  "amy_max_oscs": 336,
  "amy_max_sequencer_tags": 1280,
  "amy_max_sequence_events": 64,
  "amy_max_sequence_executions": 40,
  "amy_max_buses": 11,
  "debug": {
    "log_amy_commands": false,
    "amy_command_log": "~/.omnichord/amy_debug.log",
    "log_logical_events": true
  },
  "patch_compatibility": {
    "57": {
      "label": "Juno A82 Resonance Funk",
      "reason": "All Juno sound-source amplitudes are zero; add a small noise excitation so the resonant VCF has input.",
      "juno_noise_amp": 0.05
    },
    "68": {
      "label": "Juno B15 Harpsichord 1",
      "reason": "Factory patch requests an extreme filter state; constrain the P4 filter to a stable bright range.",
      "juno_filter_hz": 4000.0,
      "juno_resonance": 1.0
    },
    "74": {
      "label": "Juno B23 Orchestral Pad",
      "reason": "Factory patch sets gather/output osc amp const to zero; AMY skips rendering when amp const is zero.",
      "juno_output_amp": 1.0
    },
    "89": {
      "label": "Juno B26 Harpsichord 2",
      "reason": "Factory filter base is at the unsafe top edge; keep the P4 filter in a stable bright range.",
      "juno_filter_hz": 6000.0
    },
    "48": {
      "label": "Juno A71 Sweep I",
      "reason": "Factory filter base is at the previous 18 kHz UI limit; constrain it below the DSP safety ceiling.",
      "juno_filter_hz": 9000.0
    },
    "109": {
      "label": "Juno B66 Toy Rhodes",
      "reason": "Factory patch has zero amplitude on every Juno sound source; add a small noise excitation so its high-Q filter has input.",
      "juno_noise_amp": 0.05
    },
    "116": {
      "label": "Juno B73 High Bells",
      "reason": "Factory patch has no audible excitation on current AMY; add a small noise source for the resonant voice.",
      "juno_noise_amp": 0.05
    }
  },
  "buses": {
    "drums": 0,
    "bass": 1,
    "strum": 2,
    "chord": 3,
    "midi_rows": [4, 5, 6, 7, 8, 9],
    "midi_drums": 10
  }
}
